NOM_EVENEMENT,JOUR,MOIS,ANNEE,SOURCE
Nomination de Philippe de Rigaud de Vaudreuil comme gouverneur de Montréal,28,5,1699,"ROY, Pierre-Georges. Les officiers d'état-major […] p. 12"
Permission accordée par le roi de France aux Frères hospitaliers de la Croix et de Saint-Joseph d'établir des ateliers dans leur maison et de former des artisans compétents,,,1699,"J. Provencher, Chronologie…, p. 79"
"Concession de l'arrière-fief de Bourg-Royal, dépendance de la seigneurie de Notre-Dame-des-Anges, (Québec) à Charles Denys de Vitré par la Compagnie de Jésus",4,5,1699,"CÉLAT, Seigneuries et fiefs du Québec - Nomenclature et cartographie, 1988"
"Concession de l'arrière-fief Douville, dépendance de la seigneurie de Saint-Ours, (Richelieu, Saint-Hyacinthe) à Michel Dagneaux de Douville par Pierre de Saint-Ours",26,10,1699,"CÉLAT, Seigneuries et fiefs du Québec - Nomenclature et cartographie, 1988"
"Concession de l'arrière-fief Gastineau, dépendance de la seigneurie Grosbois-Est, (Saint-Maurice) à Nicolas Gastineau Duplessis par Pierre Boucher de Grosbois",12,9,1699,"CÉLAT, Seigneuries et fiefs du Québec - Nomenclature et cartographie, 1988"
Nomination de Louis de La Porte de Louvigny comme major de Trois-Rivières,20,4,1700,"ROY, Pierre-Georges. Les officiers d'état-major […] p. 15"
Abolition des festivités hivernales du carnaval par Mgr de Saint-Vallier,,,1700,"J. Provencher, Chronologie…, p. 80"
Fondation de la Compagnie du Canada (Compagnie de la Colonie),,,1700,"J. Provencher, Chronologie…, p. 80"
"Concession du fief Tarieu (Berthier, Joliette) à Pierre-Thomas Tarieu de La Pérade par le gouverneur Callière et l'intendant Champigny",30,10,1700,"CÉLAT, Seigneuries et fiefs du Québec - Nomenclature et cartographie, 1988"
"Érection en baronnie de la seigneurie de Longueuil, possession de Charles Le Moyne de Longueuil",26,1,1700,"CÉLAT, Seigneuries et fiefs du Québec - Nomenclature et cartographie, 1988"
"Retour de Mgr de Laval comme d'évêque de Québec pour remplacer temporairement Mgr de Saint-Vallier, en voyage en France, puis prisonnier des Anglais",,,1700,"J. Provencher, Chronologie…, p. 80"
Signature du traité de la Grande Paix de Montréal,4,8,1701,"J. Hamelin, Brève histoire…, p. 17, J. Provencher, Chronologie…, p. 80, ASQ-1915, p. 4"
Concession de la seigneurie de Lespinay (Montmagny) à Jean-Baptiste Couillard de Lespinay par le gouverneur Callière et l'intendant Champigny,7,4,1701,"CÉLAT, Seigneuries et fiefs du Québec - Nomenclature et cartographie, 1988"
Concession de la seigneurie Saint-Charles-de-Yamaska (Richelieu) à René Fézeret par le gouverneur Callière et l'intendant Champigny,4,8,1701,"CÉLAT, Seigneuries et fiefs du Québec - Nomenclature et cartographie, 1988"
Concession de la seigneurie Saint-Jean (Maskinongé) aux Ursulines de Trois-Rivières par le gouverneur Callière et l'intendant Champigny,13,10,1701,"CÉLAT, Seigneuries et fiefs du Québec - Nomenclature et cartographie, 1988"
"Publication à Paris du Catéchisme de Mgr de Saint-Vallier, premier catéchisme diocésain de la Nouvelle-France",,,1702,"J. Mathieu, Les mémoires…, p. 203"
Nomination de Michel Godefroy de Lanctot comme major de Trois-Rivières,1,4,1702,"ROY, Pierre-Georges. Les officiers d'état-major […] p. 15"
Nomination de François de Beauharnois de La Chaussaye comme intendant de la Nouvelle-France,1,4,1702,"J. Provencher, Chronologie…, p. 81"
Concession de la seigneurie de Bonsecours (Richelieu) à François Charon par le gouverneur Callière et l'intendant Champigny,8,8,1702,"CÉLAT, Seigneuries et fiefs du Québec - Nomenclature et cartographie, 1988"
Concession du fief Maillou (Dorchester) à Joseph Maillou et à Jean Maillou par le gouverneur Callière et l'intendant Champigny,17,6,1702,"CÉLAT, Seigneuries et fiefs du Québec - Nomenclature et cartographie, 1988"
Concession de la seigneurie de Soulanges à Pierre-Jacques-Marie de Joybert par le gouverneur Callière et l'intendant Beauharnois,23,10,1702,"CÉLAT, Seigneuries et fiefs du Québec - Nomenclature et cartographie, 1988"
Concession de la seigneurie de Vaudreuil à Philippe Rigaud de Vaudreuil par le gouverneur Callière et l'intendant Beauharnois,23,10,1702,"CÉLAT, Seigneuries et fiefs du Québec - Nomenclature et cartographie, 1988"
Nomination d'Antoine de Crisafy comme gouverneur de Trois-Rivières,1,6,1703,"ROY, Pierre-Georges. Les officiers d'état-major […] p. 14"
Nomination de Louis de La Porte de Louvigny comme major de Québec,1,6,1703,"ROY, Pierre-Georges. Les officiers d'état-major […] p. 11"
Nomination de Charles-Gaspard Piot de Langloiserie comme lieutenant de roi de Québec,1,6,1703,"ROY, Pierre-Georges. Les officiers d'état-major […] p. 11"
Nomination de Philippe de Rigaud de Vaudreuil comme gouverneur de la Nouvelle-France,1,8,1703,
Augmentation du nombre de conseillers au Conseil supérieur de Québec (Conseil souverain) de 7 à 12 ,16,6,1703,"J. Provencher, Chronologie…, p. 81"
Nomination de Claude de Ramezay comme gouverneur de Montréal,15,5,1704,"ROY, Pierre-Georges. Les officiers d'état-major […] p. 12"
Première invasion de la tordeuse des bourgeons de l'épinette en Nouvelle-France,,,1704,"J. Provencher, Chronologie…, p. 82, 104, 135, 167, 198, 232, 286"
Nomination de Jacques Raudot et d'Antoine-Denis Raudot comme co-intendants de la Nouvelle-France,1,1,1705,http://www.biographi.ca/fr/bio/raudot_antoine_denis_2F.html
"Nomination de Pierre da Silva comme facteur, première personne à assurer le transport de la correspondance entre Québec, Trois-Rivières et Montréal",23,12,1705,"J. Provencher, Chronologie…, p. 85"
Concession de la seigneurie de Carufel (Maskinongé) à Jean Sicard de Carufel par le gouverneur Rigaud et l'intendant Beauharnois,21,4,1705,"CÉLAT, Seigneuries et fiefs du Québec - Nomenclature et cartographie, 1988"
"Nomination de Charles Le Moyne, premier baron de Longueuil, comme major de Montréal",27,5,1706,"ROY, Pierre-Georges. Les officiers d'état-major […] p. 13"
"Liquidation de la Compagnie du Canada (Compagnie de la Colonie), le monopole des fourrures est cédé à des marchands français",,,1706,"J. Provencher, Chronologie…, p. 83"
Concession de la seigneurie de Saint-Paul (Saguenay) à Jean-Amador Godefroy de Saint-Paul par Le gouverneur Vaudreuil et l'intendant Raudot,20,3,1706,"CÉLAT, Seigneuries et fiefs du Québec - Nomenclature et cartographie, 1988"
Concession de la seigneurie de Granville (Kamouraska) à Marie-Anne Bécart de Granville par le gouverneur Vaudreuil et l'intendant Raudot,5,10,1707,"CÉLAT, Seigneuries et fiefs du Québec - Nomenclature et cartographie, 1988"
Concession du fief Martel (L'Assomption) à Nicolas Martel par Raymond Martel,20,7,1707,"CÉLAT, Seigneuries et fiefs du Québec - Nomenclature et cartographie, 1988"
Concession de la seigneurie de Paspébiac (Bonaventure) à Pierre Haimard par le gouverneur Vaudreuil et l'intendant Raudot,10,11,1707,"CÉLAT, Seigneuries et fiefs du Québec - Nomenclature et cartographie, 1988"
Disparition de la monnaie métallique du marché canadien et remplacement par la monnaie de carte,,,1708,"J. Provencher, Chronologie…, p. 84"
Concession du fief de Bailleul (L'Assomption) à Pierre Martel par Raymond Martel,6,3,1708,"CÉLAT, Seigneuries et fiefs du Québec - Nomenclature et cartographie, 1988"
"Concession de l'arrière-fief de Baudoin, dépendance de la seigneurie de Tilly, (Lotbinière) à Anne Aubert par Noël Legardeur de Tilly",2,12,1708,"CÉLAT, Seigneuries et fiefs du Québec - Nomenclature et cartographie, 1988"
"Concession de la seigneurie de Bourg-Marie (Richelieu, Yamaska) à Marie-Joseph Fezeret par le gouverneur Vaudreuil et l'intendant Raudot",1,8,1708,"CÉLAT, Seigneuries et fiefs du Québec - Nomenclature et cartographie, 1988"
"Concession de la seigneurie Dumontier (Maskinongé, Saint-Maurice) à François Dumontier par le gouverneur Vaudreuil et l'intendant Raudot",24,10,1708,"CÉLAT, Seigneuries et fiefs du Québec - Nomenclature et cartographie, 1988"
"Concession de la seigneurie de Monnoir (Iberville, Missisquoi, Rouville) à Claude de Ramezay par le gouverneur Vaudreuil et l'intendant Raudot",25,3,1708,"CÉLAT, Seigneuries et fiefs du Québec - Nomenclature et cartographie, 1988"
Légalisation de l'achat d'esclaves au Canada par l'intendant Jacques Raudot,13,4,1709,"J. Provencher, Chronologie…, p. 84"
Nomination de Raymond-Blaise des Bergères comme major de Trois-Rivières,5,5,1710,"ROY, Pierre-Georges. Les officiers d'état-major […] p. 15"
Nomination de François de Galliffet comme gouverneur de Trois-Rivières,5,5,1710,"ROY, Pierre-Georges. Les officiers d'état-major […] p. 14"
Nomination de Jean Bouillet de la Chassaigne comme major de Montréal,5,5,1710,"ROY, Pierre-Georges. Les officiers d'état-major […] p. 13"
"Nomination de Charles Le Moyne, premier baron de Longueuil, comme lieutenant de roi de Montréal",5,5,1710,"ROY, Pierre-Georges. Les officiers d'état-major […] p. 12"
Nomination de Michel Bégon comme intendant de la Nouvelle-France,31,3,1710,"J. Provencher, Chronologie…, p. 85"
"Concession de l'arrière-fief de Baudoin, dépendance de la seigneurie de Tilly, (Lotbinière) à Anne Aubert par Noël Legardeur de Tilly",15,5,1710,"CÉLAT, Seigneuries et fiefs du Québec - Nomenclature et cartographie, 1988"
Concession de la seigneurie de Montarville (Chambly) à Pierre Boucher de Boucherville par le gouverneur Vaudreuil et l'intendant Raudot,17,10,1710,"CÉLAT, Seigneuries et fiefs du Québec - Nomenclature et cartographie, 1988"
Concession de la seigneurie de Ramezay (Bagot) à Claude de Ramezay par le gouverneur Vaudreuil et l'intendant Raudot,17,10,1710,"CÉLAT, Seigneuries et fiefs du Québec - Nomenclature et cartographie, 1988"
Naufrage de la flotte de l'amiral britannique Hovenden Walker au large de l'île aux Œufs,22,8,1711,"J. Provencher, Chronologie…, p. 85, ASQ-1915, p. 4"
Nouvelle dénomination pour l'église de Notre-Dame-de-la-Victoire qui devient Notre-Dame-des-Victoires,,,1711,"J. Provencher, Chronologie…, p. 85"
Fin des travaux de reconstruction du fort Chambly,,,1711,"J. Provencher, Chronologie…, p. 85"
Expansion du diocèse de Québec à toute l'Amérique du Nord,,,1712,
Nomination de Joseph Desjordy de Cabanac comme major de Trois-Rivières,18,6,1712,"ROY, Pierre-Georges. Les officiers d'état-major […] p. 15"
Fondation de la ville de Louisbourg,,,1712,
"Signature du traité d'Utrecht, la France cède à l'Angleterre une partie de l'Acadie",11,4,1713,"J. Mathieu, Les mémoires…, p. 60"
Concession de la seigneurie de Ramezay (Saint-Hyacinthe) à Claude de Ramezay par le gouverneur Vaudreuil et l'Intendant Bégon,24,3,1713,"CÉLAT, Seigneuries et fiefs du Québec - Nomenclature et cartographie, 1988"
Nomination de Jean-Louis de la Corne comme major de Trois-Rivières,12,5,1714,"ROY, Pierre-Georges. Les officiers d'état-major […] p. 15"
Protestation devant le Conseil supérieur contre la mauvaise qualité et le prix élevé du pain par huit femmes de Québec,,7,1714,"J. Provencher, Chronologie…, p. 87"
"Concession de la seigneurie de Blainville (Deux-Montagnes, Terrebonne) à Jean Petit et Charles Gaspard Piot de Langloiserie par le gouverneur Vaudreuil",5,3,1714,"CÉLAT, Seigneuries et fiefs du Québec - Nomenclature et cartographie, 1988"
"Concession de l'arrière-fief de la Pinardière, dépendance de la seigneurie de Champlain, (Champlain) à François Dumontier par Martin Rémy de Montmidy",8,2,1714,"CÉLAT, Seigneuries et fiefs du Québec - Nomenclature et cartographie, 1988"
Concession de la seigneurie de la Rivière-du-Chêne (Deux-Montagnes) à Charles-Gaspard Piot de Langloiserie et à Jean Petit par le gouverneur Vaudreuil et l'Intendant Bégon,5,3,1714,"CÉLAT, Seigneuries et fiefs du Québec - Nomenclature et cartographie, 1988"
Mort de Louis XIV,1,9,1715,
Nomination de Jacques L'Hermitte comme lieutenant de roi de Trois-Rivières,10,3,1715,"ROY, Pierre-Georges. Les officiers d'état-major […] p. 14"
Nomination de François le Verrier de Rousson comme major de Montréal,27,4,1716,"ROY, Pierre-Georges. Les officiers d'état-major […] p. 13"
Nomination de Louis de La Porte de Louvigny comme lieutenant de Roi de Québec,27,4,1716,"ROY, Pierre-Georges. Les officiers d'état-major […] p. 11"
Nomination de François Mariaucheau d'Esgly comme major de Trois-Rivières,12,1,1716,"ROY, Pierre-Georges. Les officiers d'état-major […] p. 15"
Nomination de Jean Bouillet de la Chassaigne comme major de Québec,27,4,1716,"ROY, Pierre-Georges. Les officiers d'état-major […] p. 11"
Mise sur pied d'un programme de redressement économique de la Nouvelle-France basé sur la diversification,,,1716,"J. Provencher, Chronologie…, p. 88"
Instauration de l'Amirauté de Québec,12,1,1717,"J. Hamelin, Brève histoire…, p. 23"
"Autorisation aux marchands de Québec et de Montréal de se réunir quotidiennement dans un lieu appelé ""bourse""",,,1717,"J. Provencher, Chronologie…, p. 88"
Adjonction d'un asile d'aliénés pour femmes à l'Hôpital général de Québec,,,1717,"J. Provencher, Chronologie…, p. 88"
Établissement du fort Churchill (fort Prince-de-Galles) par la Compagnie de la Baie d'Hudson,,,1717,"J. Provencher, Chronologie…, p. 88"
Concession de la seigneurie du Lac-des-Deux-Montagnes (Deux-Montagnes) à la Compagnie des prêtres de Saint-Sulpice par le gouverneur Vaudreuil et l'Intendant Bégon,17,10,1717,"CÉLAT, Seigneuries et fiefs du Québec - Nomenclature et cartographie, 1988"
Début de la construction de la forteresse de Louisbourg,,,1718,"J. Provencher, Chronologie…, p. 89"
Abolition de la monnaire de cartes en Nouvelle-France,,,1719,"J. Provencher, Chronologie…, p. 89"
Arrêt qui permet à la Compagnie des Indes de faire des perquisitions à l'improviste chez les habitants afin de protéger son monopole sur les fourrures,4,6,1719,"J. Provencher, Chronologie…, p. 89"
"Concession de l'arrière-fief de Varennes, dépendance de la seigneurie de l'Île-Jésus, à Jacques-René Gaultier de Varennes par le Séminaire de Québec",27,4,1719,"CÉLAT, Seigneuries et fiefs du Québec - Nomenclature et cartographie, 1988"
"Concession de l'arrière-fief d'Youville, dépendance de la seigneurie de l'Île-Jésus, à Marguerite Dufrost de Lajemmerais par le Séminaire de Québec",27,4,1719,"CÉLAT, Seigneuries et fiefs du Québec - Nomenclature et cartographie, 1988"
Nomination de François Desjordy Moreau de Cabanac,7,5,1720,"ROY, Pierre-Georges. Les officiers d'état-major […] p. 15"
"Nomination de Charles Le Moyne, premier baron de Longueuil, comme gouverneur de Trois-Rivières",7,5,1720,"ROY, Pierre-Georges. Les officiers d'état-major […] p. 14"
Nomination de Jean Bouillet de la Chassaigne comme lieutenant de roi de Montréal,7,5,1720,"ROY, Pierre-Georges. Les officiers d'état-major […] p. 12"
Nomination de François Mariaucheau d'Esgly comme major de Québec,7,5,1720,"ROY, Pierre-Georges. Les officiers d'état-major […] p. 11"
"Concession de l'arrière-fief de Besson, dépendance de la seigneurie de l'Île-Bizard, (Montréal) à Charles Renaud Dubuisson par Hector Bizard",3,2,1720,"CÉLAT, Seigneuries et fiefs du Québec - Nomenclature et cartographie, 1988"
Vente de la seigneurie Saint-Vallier (Bellechasse) à l'hôpital Général de Québec par Louis-Joseph Morel de La Durantaye,18,8,1720,"CÉLAT, Seigneuries et fiefs du Québec - Nomenclature et cartographie, 1988"
Introduction de la culture du tabac en Nouvelle-France afin de diversifier les cultures,,,1721,"J. Hamelin, Brève histoire…, p. 32, J. Provencher, Chronologie…, p. 90"
Grand incendie de Montréal,19,6,1721,"J. Provencher, Chronologie…, p. 90"
Privilège accordé à Nicolas Larrouiller d'ouvrir un système postal entre Québec et Montréal,,,1721,"J. Provencher, Chronologie…, p. 90"
Établissement d'un règlement obligeant les capitaines de navires de faire un bilan de santé des passagers à l'île aux Coudres pour pouvoir naviguer plus loin,,,1721,"J. Provencher, Chronologie…, p. 90"
"Concession de l'arrière-fief de Ramezay, dépendance de la seigneurie de l'Île-Jésus, à Claude de Ramezay par Louis Lepage",4,3,1721,"CÉLAT, Seigneuries et fiefs du Québec - Nomenclature et cartographie, 1988"
"Sacre de Louis XV, roi de France",25,10,1722,http://www.cathedrale-reims.culture.fr/chronologie-des-sacres.html
Début de l'immigration pénale en Nouvelle-France,,,1722,"J. Provencher, Chronologie…, p. 91"
Adjonction d'un asile d'aliénés pour hommes à l'Hôpital général de Québec,,,1722,"J. Provencher, Chronologie…, p. 91"
"Concession de l'arrière-fief de la Malotière, dépendance de la seigneurie de La Pocatière, (Kamouraska) à Pierre Ruette de La Malotière par François-Madeleine-Fortuné Ruette d'Auteuil de Monceaux",3,5,1722,"CÉLAT, Seigneuries et fiefs du Québec - Nomenclature et cartographie, 1988"
"Concession de l'arrière-fief de Boucault, dépendance de la seigneurie de Beloeil, (Verchères) à Nicolas-Gaspard Boucault par Charles Le Moyne, baron de Longueuil",15,4,1723,"CÉLAT, Seigneuries et fiefs du Québec - Nomenclature et cartographie, 1988"
Nomination de Louis de La Porte de Louvigny comme gouverneur de Trois-Rivières,26,12,1724,"ROY, Pierre-Georges. Les officiers d'état-major […] p. 14"
"Nomination de Charles Le Moyne, premier baron de Longueuil, comme gouverneur de Montréal",9,9,1724,"ROY, Pierre-Georges. Les officiers d'état-major […] p. 12"
Nomination d'Edme-Nicolas Robert comme intendant de la Nouvelle-France,22,2,1724,http://books.google.ca/books?id=VjTZAAAAMAAJ&pg=PA28&lpg=PA28&dq=22+f%C3%A9vrier+1724+edme-nicolas+robert&source=bl&ots=1PbgXQJMNQ&sig=dCCoLiVPAzCQj_HliBMx66YJ9PQ&hl=en&sa=X&ei=sgk_U7zaMpSqsATntoD4DA&ved=0CC0Q6AEwAA#v=onepage&q=22%20f%C3%A9vrier%201724%20edme-nicolas%20robert&f=false
Nomination de Jacques-Charles de Sabrevois comme major de Montréal,,5,1725,"ROY, Pierre-Georges. Les officiers d'état-major […] p. 13"
Nomination de François le Verrier de Rousson comme lieutenant de roi de Québec,15,5,1725,"ROY, Pierre-Georges. Les officiers d'état-major […] p. 11"
"Naufrage du navire ""Le Chameau"", qui transporte l'intendant de Chazel, au large de l'île du Cap-Breton",27,8,1725,http://www.blupete.com/Hist/Gloss/Chameau.htm
Pressions réussies de l'intendant et de l'évêque pour faire cesser l'immigration pénale en Nouvelle-France débutée en 1723,,,1725,"J. Provencher, Chronologie…, p. 92"
Instauration d'un règlement interdisant des jeux de hasard dans les cabarets,,,1726,"J. Provencher, Chronologie…, p. 93"
Nomination de Charles de Beauharnois de La Boische comme gouverneur de la Nouvelle-France,,2,1726,"J. Provencher, Chronologie…, p. 93"
Nomination de François Mariaucheau d'Esgly comme lieutenant de roi de Trois-Rivières,23,4,1726,"ROY, Pierre-Georges. Les officiers d'état-major […] p. 14"
Nomination de Jean Bouillet de la Chassaigne comme gouverneur de Trois-Rivières,23,4,1726,"ROY, Pierre-Georges. Les officiers d'état-major […] p. 14"
Nomination de Jean-Louis de la Corne comme lieutenant de roi de Montréal,23,4,1726,"ROY, Pierre-Georges. Les officiers d'état-major […] p. 12"
Nomination de Claude-Michel Bégon comme major de Québec,23,4,1726,"ROY, Pierre-Georges. Les officiers d'état-major […] p. 11"
Entrée en fonction de Claude-Thomas Dupuy comme intendant de la Nouvelle-France,2,9,1726,"J. Provencher, Chronologie…, p. 93"
Incendie du palais de l'intendant à Québec,,,1727,"J. Provencher, Chronologie…, p. 93"
Nomination de François de Gannes de Falaise comme major de Trois-Rivières,11,4,1727,"ROY, Pierre-Georges. Les officiers d'état-major […] p. 15"
Entrée en fonction de Mgr Louis-François Duplessis de Mornay comme évêque de Québec,26,12,1727,http://www.erudit.org/revue/schec/1963/v30/n/1007355ar.pdf
Établissement d'un règlement obligeant les charretiers à s'inscrire auprès de l'intendant et de munir leur voiture d'un numéro pour exercer leur métier dans les villes,,,1727,"J. Provencher, Chronologie…, p. 93"
"Concession de l'arrière-fief Péan de Livaudière, dépendance de la seigneurie de Contrecoeur, (Verchères) à Pierre-René Péan de Livaudière par le seigneur de Contrecoeur",17,7,1727,"CÉLAT, Seigneuries et fiefs du Québec - Nomenclature et cartographie, 1988"
Nomination de Constant Lemarchand de Lignery comme major de Trois-Rivières,16,3,1728,"ROY, Pierre-Georges. Les officiers d'état-major […] p. 15"
Nomination de François de Gannes de Falaise comme major de Montréal,16,3,1728,"ROY, Pierre-Georges. Les officiers d'état-major […] p. 13"
"Concession de l'arrière-fief Dubuisson, dépendance de la seigneurie de l'Île-Bizard, (Montréal) à Louis-Jacques-Charles Renaud Dubuisson par Louise Bizard",6,3,1728,"CÉLAT, Seigneuries et fiefs du Québec - Nomenclature et cartographie, 1988"
"Concession de l'arrière-fief Louis-Charles-Renaud Dubuisson, dépendance de la seigneurie de l'Île-Bizard, à Louis-Charles Renaud Dubuisson par Louise Bizard",6,3,1728,"CÉLAT, Seigneuries et fiefs du Québec - Nomenclature et cartographie, 1988"
"Concession de l'arrière-fief Louise-Renaud Dubuisson, dépendance de la seigneurie de l'Île-Bizard, à Louis Renaud Dubuisson par Louise Bizard",9,5,1728,"CÉLAT, Seigneuries et fiefs du Québec - Nomenclature et cartographie, 1988"
"Concession de l'arrière-fief Marianne-Gabrielle-Renaud Dubuisson, dépendance de la seigneurie de l'Île-Bizard, à Marianne-Gabrielle Renaud Dubuisson par Louise Bizard",8,5,1728,"CÉLAT, Seigneuries et fiefs du Québec - Nomenclature et cartographie, 1988"
"Concession de l'arrière-fief Marie-Charlotte-Renaud Dubuisson, dépendance de la seigneurie de l'Île-Bizard, à Marie-Charlotte Renaud Dubuisson par Louise Bizard",7,5,1728,"CÉLAT, Seigneuries et fiefs du Québec - Nomenclature et cartographie, 1988"
"Concession de l'arrière-fief Marie-Madeleine-Renaud Dubuisson, dépendance de la seigneurie de l'Île-Bizard, à Marie-Madeleine Renaud Dubuisson par Louise Bizard",11,5,1728,"CÉLAT, Seigneuries et fiefs du Québec - Nomenclature et cartographie, 1988"
Relance de la construction navale dans la colonie par l'intendant Gilles Hocquart,,,1729,"J. Hamelin, Brève histoire…, p. 32"
Première consommation de la pomme de terre,,,1729,"J. Provencher, Chronologie…, p. 94"
Retour de la monnaie de carte,,,1729,"J. Provencher, Chronologie…, p. 94"
"Établissement d'un règlement obligeant les habitants de Québec, Montréal et Trois-Rivières de baliser leurs terres lorsqu'elles sont sur les grands chemins",,,1729,"J. Provencher, Chronologie…, p. 94"
Nomination de Gilles Hocquart comme intendant intérimaire de la Nouvelle-France,8,3,1729,DBC
Concession de la seigneurie de Beauharnois (Beauharnois) à Charles de Beauharnois de la Boische et à Claude de Beauharnois de Beaumont par Sa Majesté Louis XV,12,4,1729,"CÉLAT, Seigneuries et fiefs du Québec - Nomenclature et cartographie, 1988"
"Concession de l'arrière-fief Daine, dépendance de la seigneurie de Contrecoeur, (Verchères) à Charlotte de Pécaudy de Contrecoeur par François-Antoine de Pécaudy de Contrecoeur",1,8,1729,"CÉLAT, Seigneuries et fiefs du Québec - Nomenclature et cartographie, 1988"
"Concession de l'arrière-fief Daine, dépendance de la seigneurie de Contrecoeur, (Verchères) à Renée de Pécaudy de Contrecoeur par François-Antoine de Pécaudy de Contrecoeur",1,8,1729,"CÉLAT, Seigneuries et fiefs du Québec - Nomenclature et cartographie, 1988"
"Concession de l'arrière-fief Daine, dépendance de la seigneurie de Contrecoeur, (Verchères) à Louise de Pécaudy de Contrecoeur par François-Antoine de Pécaudy de Contrecoeur",1,8,1729,"CÉLAT, Seigneuries et fiefs du Québec - Nomenclature et cartographie, 1988"
"Concession de l'arrière-fief Péan de Livaudière, dépendance de la seigneurie de Contrecoeur, (Verchères) à Michel-Jean-Hugues Péan de Livaudière par le seigneur de Contrecoeur",17,7,1729,"CÉLAT, Seigneuries et fiefs du Québec - Nomenclature et cartographie, 1988"
Nomination de Josué Dubois Berthelot de Beaucours comme gouverneur de Trois-Rivières,16,1,1730,"ROY, Pierre-Georges. Les officiers d'état-major […] p. 14"
Nomination de Jean Bouillet de la Chassaigne comme gouverneur de Montréal,16,6,1730,"ROY, Pierre-Georges. Les officiers d'état-major […] p. 12"
Création des Forges du Saint-Maurice,25,3,1730,"J. Hamelin, Brève histoire…, p. 33"
Nomination de Jean-Baptiste de Saint-Ours Deschaillons comme major de Québec,5,2,1731,"ROY, Pierre-Georges. Les officiers d'état-major […] p. 11"
Nomination de Claude-Michel Bégon comme lieutenant de roi de Trois-Rivières,6,2,1731,"ROY, Pierre-Georges. Les officiers d'état-major […] p. 14"
Nomination officielle de Gilles Hocquart comme intendant de la Nouvelle-France,21,2,1731,"J. Provencher, Chronologie…, p. 94"
Début des explorations de Pierre Gaultier de Varennes et de La Vérendrye,8,6,1731,"J. Provencher, Chronologie…, p. 95, ASQ-1915p. 5"
Concession de la seigneurie Dosquet (localisation incertaine) à Pierre-Herman Dosquet par le gouverneur Beauharnois et l'intendant Hocquart,15,10,1731,"CÉLAT, Seigneuries et fiefs du Québec - Nomenclature et cartographie, 1988"
Concession de la seigneurie des Plaines (Terrebonne) à Louis Lepage de Sainte-Claire par Sa Majesté Louis XV,10,4,1731,"CÉLAT, Seigneuries et fiefs du Québec - Nomenclature et cartographie, 1988"
Début des travaux pour la construction du chemin du Roy,,,1731,www.lecheminduroy.com/fr/historique.php
Concession de la seigneurie Rigaud (Vaudreuil) à Pierre de Rigaud de Cavagnial et à Pierre-François de Rigaud par le gouverneur Beauharnois et l'intendant Hocquart,29,10,1732,"CÉLAT, Seigneuries et fiefs du Québec - Nomenclature et cartographie, 1988"
